{
  "schema_version": "5.0",
  "project_metadata": {
    "name": "mistnost_2_v7",
    "export_date": "2026-10-22T20:52:42Z",
    "units": "mm",
    "up_axis": "Z_UP",
    "global_origin_gps": null,
    "source": {
      "channel": "dae",
      "file": "mistnost_2_v7.dae",
      "path": "examples\\Sketchup2024_export\\mistnost_2_v7.dae",
      "size_bytes": 166765,
      "mtime_utc": "2026-10-22T20:51:35Z",
      "model_hash": "sha256:66b455d4013c1e921bdf98c1561c0f8afca216427e405fa01eba9a11aacb5a98"
    },
    "capabilities": {
      "hierarchy": true,
      "bbox_mm": true,
      "rotation": true,
      "instance_definition": true,
      "tags": false,
      "metadata_dictionaries": false,
      "persistent_ids": false,
      "gps": false,
      "note": "DAE channel: SketchUp replaces spaces with underscores in names, does not export tags, attribute dictionaries or persistent IDs."
    }
  },
  "nodes": [
    {
      "uid": "ID3",
      "persistent_id": null,
      "name": "Worktop__01_hlavní_pracovni_plocha_dřevěná",
      "definition_name": "worktop_user",
      "entity_type": "component",
      "tag": null,
      "hierarchy_path": [
        "Worktop__01_hlavní_pracovni_plocha_dřevěná"
      ],
      "parent_uid": null,
      "spatial": {
        "origin_mm": {
          "x": 1520.0,
          "y": 1760.0,
          "z": 745.0
        },
        "rotation_deg": {
          "x": 0.0,
          "y": -0.0,
          "z": 0.0
        },
        "quaternion": {
          "w": 1.0,
          "x": 0.0,
          "y": 0.0,
          "z": 0.0
        },
        "matrix_4x4": [
          [
            1.0,
            0.0,
            0.0,
            1520.0
          ],
          [
            0.0,
            1.0,
            0.0,
            1760.0
          ],
          [
            0.0,
            0.0,
            1.0,
            745.0
          ],
          [
            0.0,
            0.0,
            0.0,
            1.0
          ]
        ],
        "scale": {
          "x": 1.0,
          "y": 1.0,
          "z": 1.0
        },
        "bbox_mm": {
          "min": {
            "x": 1520.0,
            "y": 1760.0,
            "z": 745.0
          },
          "max": {
            "x": 3780.0,
            "y": 1960.0,
            "z": 795.0
          }
        },
        "size_mm": {
          "x": 2260.0,
          "y": 200.0,
          "z": 50.0
        },
        "center_mm": {
          "x": 2650.0,
          "y": 1860.0,
          "z": 770.0
        }
      },
      "metadata": {},
      "semantics": {
        "role": "worktop",
        "zone": "work",
        "intent": "DESIGN_DECISION",
        "confidence": 0.85,
        "evidence": [
          {
            "rule_id": "R_NAME_ROLE_WORKTOP",
            "rule_class": "CLASS_B",
            "support_n": 1,
            "detail": "name token 'worktop' at 0"
          }
        ]
      }
    },
    {
      "uid": "ID15",
      "persistent_id": null,
      "name": "Bed_01_mattres_with_light_frame",
      "definition_name": "sleep_zone",
      "entity_type": "component",
      "tag": null,
      "hierarchy_path": [
        "Bed_01_mattres_with_light_frame"
      ],
      "parent_uid": null,
      "spatial": {
        "origin_mm": {
          "x": 2495.0,
          "y": 0.0,
          "z": 0.0
        },
        "rotation_deg": {
          "x": 0.0,
          "y": -0.0,
          "z": 0.0
        },
        "quaternion": {
          "w": 1.0,
          "x": 0.0,
          "y": 0.0,
          "z": 0.0
        },
        "matrix_4x4": [
          [
            1.0,
            0.0,
            0.0,
            2495.0001
          ],
          [
            0.0,
            1.0,
            0.0,
            0.0
          ],
          [
            0.0,
            0.0,
            1.0,
            0.0
          ],
          [
            0.0,
            0.0,
            0.0,
            1.0
          ]
        ],
        "scale": {
          "x": 1.0,
          "y": 1.0,
          "z": 1.0
        },
        "bbox_mm": {
          "min": {
            "x": 2495.0,
            "y": 0.0,
            "z": 0.0
          },
          "max": {
            "x": 4495.0,
            "y": 970.0,
            "z": 180.0
          }
        },
        "size_mm": {
          "x": 2000.0,
          "y": 970.0,
          "z": 180.0
        },
        "center_mm": {
          "x": 3495.0,
          "y": 485.0,
          "z": 90.0
        }
      },
      "metadata": {},
      "semantics": {
        "role": "bed",
        "zone": "sleep",
        "intent": "DESIGN_DECISION",
        "confidence": 0.9,
        "evidence": [
          {
            "rule_id": "R_NAME_ROLE_BED",
            "rule_class": "CLASS_B",
            "support_n": 1,
            "detail": "name token 'bed' at 0"
          },
          {
            "rule_id": "R_NAME_ZONE_SLEEP",
            "rule_class": "CLASS_B",
            "support_n": 1,
            "detail": "zone token 'bed'"
          }
        ]
      }
    },
    {
      "uid": "ID27",
      "persistent_id": null,
      "name": "Kamna_Priti_mini_D_zone_bed_energy_wall_primary_wood_fuel",
      "definition_name": "stove_main",
      "entity_type": "component",
      "tag": null,
      "hierarchy_path": [
        "Kamna_Priti_mini_D_zone_bed_energy_wall_primary_wood_fuel"
      ],
      "parent_uid": null,
      "spatial": {
        "origin_mm": {
          "x": 3988.529,
          "y": 1612.4,
          "z": 0.0
        },
        "rotation_deg": {
          "x": 0.0,
          "y": -0.0,
          "z": 0.0
        },
        "quaternion": {
          "w": 1.0,
          "x": 0.0,
          "y": 0.0,
          "z": 0.0
        },
        "matrix_4x4": [
          [
            0.8989,
            0.0,
            0.0,
            3988.529
          ],
          [
            0.0,
            0.82,
            0.0,
            1612.3999
          ],
          [
            0.0,
            0.0,
            1.0,
            0.0
          ],
          [
            0.0,
            0.0,
            0.0,
            1.0
          ]
        ],
        "scale": {
          "x": 0.8989,
          "y": 0.82,
          "z": 1.0
        },
        "bbox_mm": {
          "min": {
            "x": 3988.529,
            "y": 1612.4,
            "z": 0.0
          },
          "max": {
            "x": 4420.001,
            "y": 1924.0,
            "z": 680.0
          }
        },
        "size_mm": {
          "x": 431.472,
          "y": 311.6,
          "z": 680.0
        },
        "center_mm": {
          "x": 4204.265,
          "y": 1768.2,
          "z": 340.0
        }
      },
      "metadata": {},
      "semantics": {
        "role": "stove",
        "zone": "sleep",
        "intent": "DESIGN_DECISION",
        "confidence": 0.9,
        "evidence": [
          {
            "rule_id": "R_NAME_ROLE_STOVE",
            "rule_class": "CLASS_B",
            "support_n": 1,
            "detail": "name token 'kamna' at 0"
          },
          {
            "rule_id": "R_NAME_ZONE_SLEEP",
            "rule_class": "CLASS_B",
            "support_n": 1,
            "detail": "zone token 'bed'"
          }
        ]
      }
    },
    {
      "uid": "ID53",
      "persistent_id": null,
      "name": "LFP_main_base",
      "definition_name": "lfp_main_worktop_policka_na_main_battery",
      "entity_type": "component",
      "tag": null,
      "hierarchy_path": [
        "LFP_main_base"
      ],
      "parent_uid": null,
      "spatial": {
        "origin_mm": {
          "x": 1690.0,
          "y": 1760.0,
          "z": 490.0
        },
        "rotation_deg": {
          "x": 0.0,
          "y": -0.0,
          "z": 0.0
        },
        "quaternion": {
          "w": 1.0,
          "x": 0.0,
          "y": 0.0,
          "z": 0.0
        },
        "matrix_4x4": [
          [
            1.0,
            0.0,
            0.0,
            1689.9999
          ],
          [
            0.0,
            1.0,
            0.0,
            1760.0
          ],
          [
            0.0,
            0.0,
            1.0,
            490.0
          ],
          [
            0.0,
            0.0,
            0.0,
            1.0
          ]
        ],
        "scale": {
          "x": 1.0,
          "y": 1.0,
          "z": 1.0
        },
        "bbox_mm": {
          "min": {
            "x": 1690.0,
            "y": 1760.0,
            "z": 490.0
          },
          "max": {
            "x": 3777.0,
            "y": 2000.0,
            "z": 525.0
          }
        },
        "size_mm": {
          "x": 2087.0,
          "y": 240.0,
          "z": 35.0
        },
        "center_mm": {
          "x": 2733.5,
          "y": 1880.0,
          "z": 507.5
        }
      },
      "metadata": {},
      "semantics": {
        "role": "battery",
        "zone": "energy",
        "intent": "DESIGN_DECISION",
        "confidence": 0.8,
        "evidence": [
          {
            "rule_id": "R_NAME_ROLE_BATTERY",
            "rule_class": "CLASS_C",
            "support_n": 1,
            "detail": "name token 'lfp' at 0"
          },
          {
            "rule_id": "R_NAME_ZONE_ENERGY",
            "rule_class": "CLASS_B",
            "support_n": 1,
            "detail": "zone token 'lfp'"
          }
        ]
      }
    },
    {
      "uid": "ID61",
      "persistent_id": null,
      "name": "main_table_rectangel_food_work_dump_place",
      "definition_name": "table_main",
      "entity_type": "component",
      "tag": null,
      "hierarchy_path": [
        "main_table_rectangel_food_work_dump_place"
      ],
      "parent_uid": null,
      "spatial": {
        "origin_mm": {
          "x": -1.751,
          "y": 84.38,
          "z": -0.0
        },
        "rotation_deg": {
          "x": 0.0,
          "y": -0.0,
          "z": 0.0
        },
        "quaternion": {
          "w": 1.0,
          "x": 0.0,
          "y": 0.0,